Frame 1: 92 bytes on wire (736 bits), 92 bytes captured (736 bits) on interface en0, id 0
    Interface id: 0 (en0)
        Interface name: en0
        Interface description: Wi-Fi
    Encapsulation type: Ethernet (1)
    Arrival Time: Jul 20, 2021 19:24:07.259975000 EDT
    [Time shift for this packet: 0.000000000 seconds]
    Epoch Time: 1626823447.259975000 seconds
    [Time delta from previous captured frame: 0.000000000 seconds]
    [Time delta from previous displayed frame: 0.000000000 seconds]
    [Time since reference or first frame: 0.000000000 seconds]
    Frame Number: 1
    Frame Length: 92 bytes (736 bits)
    Capture Length: 92 bytes (736 bits)
    [Frame is marked: False]
    [Frame is ignored: False]
    [Protocols in frame: eth:ethertype:ip:udp:data]
Ethernet II, Src: Micro-St_d3:1f:05 (00:d8:61:d3:1f:05), Dst: IPv4mcast_01 (01:00:5e:00:00:01)
    Destination: IPv4mcast_01 (01:00:5e:00:00:01)
        Address: IPv4mcast_01 (01:00:5e:00:00:01)
        .... ..0. .... .... .... .... = LG bit: Globally unique address (factory default)
        .... ...1 .... .... .... .... = IG bit: Group address (multicast/broadcast)
    Source: Micro-St_d3:1f:05 (00:d8:61:d3:1f:05)
        Address: Micro-St_d3:1f:05 (00:d8:61:d3:1f:05)
        .... ..0. .... .... .... .... = LG bit: Globally unique address (factory default)
        .... ...0 .... .... .... .... = IG bit: Individual address (unicast)
    Type: IPv4 (0x0800)
Internet Protocol Version 4, Src: 192.168.0.69, Dst: 230.0.0.1
    0100 .... = Version: 4
    .... 0101 = Header Length: 20 bytes (5)
    Differentiated Services Field: 0x00 (DSCP: CS0, ECN: Not-ECT)
        0000 00.. = Differentiated Services Codepoint: Default (0)
        .... ..00 = Explicit Congestion Notification: Not ECN-Capable Transport (0)
    Total Length: 78
    Identification: 0xf449 (62537)
    Flags: 0x00
        0... .... = Reserved bit: Not set
        .0.. .... = Don't fragment: Not set
        ..0. .... = More fragments: Not set
    Fragment Offset: 0
    Time to Live: 1
    Protocol: UDP (17)
    Header Checksum: 0x1e67 [validation disabled]
    [Header checksum status: Unverified]
    Source Address: 192.168.0.69
    Destination Address: 230.0.0.1
User Datagram Protocol, Src Port: 58956, Dst Port: 6666
    Source Port: 58956
    Destination Port: 6666
    Length: 58
    Checksum: 0x7b5e [unverified]
    [Checksum Status: Unverified]
    [Stream index: 0]
    [Timestamps]
        [Time since first frame: 0.000000000 seconds]
        [Time since previous frame: 0.000000000 seconds]
    UDP payload (50 bytes)
Data (50 bytes)

0000  0c 00 00 00 00 00 00 00 00 00 00 00 00 00 00 00   ................
0010  00 d0 97 5b 09 06 40 69 4a ba cf e1 29 27 08 50   ...[..@iJ...)'.P
0020  f4 05 d0 97 5b 09 06 40 69 4a ba cf e1 29 27 08   ....[..@iJ...)'.
0030  50 f4                                             P.
    Data: 0c00000000000000000000000000000000d0975b090640694abacfe129270850f405d097…
    [Length: 50]

Frame 2: 230 bytes on wire (1840 bits), 230 bytes captured (1840 bits) on interface en0, id 0
    Interface id: 0 (en0)
        Interface name: en0
        Interface description: Wi-Fi
    Encapsulation type: Ethernet (1)
    Arrival Time: Jul 20, 2021 19:24:07.260486000 EDT
    [Time shift for this packet: 0.000000000 seconds]
    Epoch Time: 1626823447.260486000 seconds
    [Time delta from previous captured frame: 0.000511000 seconds]
    [Time delta from previous displayed frame: 0.000511000 seconds]
    [Time since reference or first frame: 0.000511000 seconds]
    Frame Number: 2
    Frame Length: 230 bytes (1840 bits)
    Capture Length: 230 bytes (1840 bits)
    [Frame is marked: False]
    [Frame is ignored: False]
    [Protocols in frame: eth:ethertype:ip:udp:data]
Ethernet II, Src: Espressi_18:f2:13 (c4:dd:57:18:f2:13), Dst: Broadcast (ff:ff:ff:ff:ff:ff)
    Destination: Broadcast (ff:ff:ff:ff:ff:ff)
        Address: Broadcast (ff:ff:ff:ff:ff:ff)
        .... ..1. .... .... .... .... = LG bit: Locally administered address (this is NOT the factory default)
        .... ...1 .... .... .... .... = IG bit: Group address (multicast/broadcast)
    Source: Espressi_18:f2:13 (c4:dd:57:18:f2:13)
        Address: Espressi_18:f2:13 (c4:dd:57:18:f2:13)
        .... ..0. .... .... .... .... = LG bit: Globally unique address (factory default)
        .... ...0 .... .... .... .... = IG bit: Individual address (unicast)
    Type: IPv4 (0x0800)
Internet Protocol Version 4, Src: 192.168.0.57, Dst: 255.255.255.255
    0100 .... = Version: 4
    .... 0101 = Header Length: 20 bytes (5)
    Differentiated Services Field: 0x00 (DSCP: CS0, ECN: Not-ECT)
        0000 00.. = Differentiated Services Codepoint: Default (0)
        .... ..00 = Explicit Congestion Notification: Not ECN-Capable Transport (0)
    Total Length: 216
    Identification: 0x16c3 (5827)
    Flags: 0x00
        0... .... = Reserved bit: Not set
        .0.. .... = Don't fragment: Not set
        ..0. .... = More fragments: Not set
    Fragment Offset: 0
    Time to Live: 255
    Protocol: UDP (17)
    Header Checksum: 0xe370 [validation disabled]
    [Header checksum status: Unverified]
    Source Address: 192.168.0.57
    Destination Address: 255.255.255.255
User Datagram Protocol, Src Port: 49154, Dst Port: 6667
    Source Port: 49154
    Destination Port: 6667
    Length: 196
    Checksum: 0x3a79 [unverified]
    [Checksum Status: Unverified]
    [Stream index: 1]
    [Timestamps]
        [Time since first frame: 0.000000000 seconds]
        [Time since previous frame: 0.000000000 seconds]
    UDP payload (188 bytes)
Data (188 bytes)

0000  00 00 55 aa 00 00 00 00 00 00 00 13 00 00 00 ac   ..U.............
0010  00 00 00 00 23 d0 1e 5f ef 56 83 33 14 ce f6 0f   ....#.._.V.3....
0020  b0 86 ed 33 8d b2 88 c3 ae 16 9c ef 03 88 71 7a   ...3..........qz
0030  da 42 45 ae 75 5a a8 ec 6b 49 0d 43 dd fb de 62   .BE.uZ..kI.C...b
0040  bf 4e c0 35 e8 39 11 b7 f2 10 22 d7 80 d2 0d ad   .N.5.9....".....
0050  53 2a 00 ed cb 59 24 bb 87 92 fe 5e ae 7c 90 40   S*...Y$....^.|.@
0060  e5 92 1a 98 01 7f 21 70 86 04 21 e6 fc 66 f0 a1   ......!p..!..f..
0070  ad e1 38 91 5f de 85 0c d1 57 27 0c 5f 3d 1a b5   ..8._....W'._=..
0080  ae 90 b3 00 29 01 0d 91 a3 d5 d6 b1 d8 f5 f7 e3   ....)...........
0090  d7 d8 70 d8 1c 83 43 bc 25 f3 40 3c 0c 4c 3d b5   ..p...C.%.@<.L=.
00a0  93 50 d3 4a e0 bd 1f 2c ba d7 05 88 6d 4e d8 ee   .P.J...,....mN..
00b0  d5 ab 9e b9 49 86 fe 1b 00 00 aa 55               ....I......U
    Data: 000055aa0000000000000013000000ac0000000023d01e5fef56833314cef60fb086ed33…
    [Length: 188]

Frame 3: 87 bytes on wire (696 bits), 87 bytes captured (696 bits) on interface en0, id 0
    Interface id: 0 (en0)
        Interface name: en0
        Interface description: Wi-Fi
    Encapsulation type: Ethernet (1)
    Arrival Time: Jul 20, 2021 19:24:07.275540000 EDT
    [Time shift for this packet: 0.000000000 seconds]
    Epoch Time: 1626823447.275540000 seconds
    [Time delta from previous captured frame: 0.015054000 seconds]
    [Time delta from previous displayed frame: 0.015054000 seconds]
    [Time since reference or first frame: 0.015565000 seconds]
    Frame Number: 3
    Frame Length: 87 bytes (696 bits)
    Capture Length: 87 bytes (696 bits)
    [Frame is marked: False]
    [Frame is ignored: False]
    [Protocols in frame: eth:ethertype:ipv6:udp:data]
Ethernet II, Src: ARRISGro_eb:7e:b7 (98:6b:3d:eb:7e:b7), Dst: Apple_99:9f:a4 (d0:e1:40:99:9f:a4)
    Destination: Apple_99:9f:a4 (d0:e1:40:99:9f:a4)
        Address: Apple_99:9f:a4 (d0:e1:40:99:9f:a4)
        .... ..0. .... .... .... .... = LG bit: Globally unique address (factory default)
        .... ...0 .... .... .... .... = IG bit: Individual address (unicast)
    Source: ARRISGro_eb:7e:b7 (98:6b:3d:eb:7e:b7)
        Address: ARRISGro_eb:7e:b7 (98:6b:3d:eb:7e:b7)
        .... ..0. .... .... .... .... = LG bit: Globally unique address (factory default)
        .... ...0 .... .... .... .... = IG bit: Individual address (unicast)
    Type: IPv6 (0x86dd)
Internet Protocol Version 6, Src: 2607:f8b0:4023:c0d::bd, Dst: 2603:7000:7e07:fc00:4de7:a20a:2b16:f9a
    0110 .... = Version: 6
    .... 0000 0000 .... .... .... .... .... = Traffic Class: 0x00 (DSCP: CS0, ECN: Not-ECT)
        .... 0000 00.. .... .... .... .... .... = Differentiated Services Codepoint: Default (0)
        .... .... ..00 .... .... .... .... .... = Explicit Congestion Notification: Not ECN-Capable Transport (0)
    .... .... .... 0000 0000 0000 0000 0000 = Flow Label: 0x00000
    Payload Length: 33
    Next Header: UDP (17)
    Hop Limit: 40
    Source Address: 2607:f8b0:4023:c0d::bd
    Destination Address: 2603:7000:7e07:fc00:4de7:a20a:2b16:f9a
User Datagram Protocol, Src Port: 443, Dst Port: 50852
    Source Port: 443
    Destination Port: 50852
    Length: 33
    Checksum: 0x4c17 [unverified]
    [Checksum Status: Unverified]
    [Stream index: 2]
    [Timestamps]
        [Time since first frame: 0.000000000 seconds]
        [Time since previous frame: 0.000000000 seconds]
    UDP payload (25 bytes)
Data (25 bytes)

0000  49 35 37 ce 5e 8e cb a9 be 54 f5 e8 b6 7b 79 e4   I57.^....T...{y.
0010  41 fb ed c4 0f 53 cc f4 a9                        A....S...
    Data: 493537ce5e8ecba9be54f5e8b67b79e441fbedc40f53ccf4a9
    [Length: 25]

Frame 4: 60 bytes on wire (480 bits), 60 bytes captured (480 bits) on interface en0, id 0
    Interface id: 0 (en0)
        Interface name: en0
        Interface description: Wi-Fi
    Encapsulation type: Ethernet (1)
    Arrival Time: Jul 20, 2021 19:24:07.874584000 EDT
    [Time shift for this packet: 0.000000000 seconds]
    Epoch Time: 1626823447.874584000 seconds
    [Time delta from previous captured frame: 0.599044000 seconds]
    [Time delta from previous displayed frame: 0.599044000 seconds]
    [Time since reference or first frame: 0.614609000 seconds]
    Frame Number: 4
    Frame Length: 60 bytes (480 bits)
    Capture Length: 60 bytes (480 bits)
    [Frame is marked: False]
    [Frame is ignored: False]
    [Protocols in frame: eth:ethertype:arp]
Ethernet II, Src: Espressi_4d:c9:04 (70:03:9f:4d:c9:04), Dst: Broadcast (ff:ff:ff:ff:ff:ff)
    Destination: Broadcast (ff:ff:ff:ff:ff:ff)
        Address: Broadcast (ff:ff:ff:ff:ff:ff)
        .... ..1. .... .... .... .... = LG bit: Locally administered address (this is NOT the factory default)
        .... ...1 .... .... .... .... = IG bit: Group address (multicast/broadcast)
    Source: Espressi_4d:c9:04 (70:03:9f:4d:c9:04)
        Address: Espressi_4d:c9:04 (70:03:9f:4d:c9:04)
        .... ..0. .... .... .... .... = LG bit: Globally unique address (factory default)
        .... ...0 .... .... .... .... = IG bit: Individual address (unicast)
    Type: ARP (0x0806)
    Padding: 000000000000000000000000000000000000
Address Resolution Protocol (ARP Announcement)
    Hardware type: Ethernet (1)
    Protocol type: IPv4 (0x0800)
    Hardware size: 6
    Protocol size: 4
    Opcode: request (1)
    [Is gratuitous: True]
    [Is announcement: True]
    Sender MAC address: Espressi_4d:c9:04 (70:03:9f:4d:c9:04)
    Sender IP address: 192.168.0.71
    Target MAC address: 00:00:00_00:00:00 (00:00:00:00:00:00)
    Target IP address: 192.168.0.71

Frame 5: 60 bytes on wire (480 bits), 60 bytes captured (480 bits) on interface en0, id 0
    Interface id: 0 (en0)
        Interface name: en0
        Interface description: Wi-Fi
    Encapsulation type: Ethernet (1)
    Arrival Time: Jul 20, 2021 19:24:07.874590000 EDT
    [Time shift for this packet: 0.000000000 seconds]
    Epoch Time: 1626823447.874590000 seconds
    [Time delta from previous captured frame: 0.000006000 seconds]
    [Time delta from previous displayed frame: 0.000006000 seconds]
    [Time since reference or first frame: 0.614615000 seconds]
    Frame Number: 5
    Frame Length: 60 bytes (480 bits)
    Capture Length: 60 bytes (480 bits)
    [Frame is marked: False]
    [Frame is ignored: False]
    [Protocols in frame: eth:ethertype:data]
Ethernet II, Src: ARRISGro_eb:7e:bf (98:6b:3d:eb:7e:bf), Dst: Broadcast (ff:ff:ff:ff:ff:ff)
    Destination: Broadcast (ff:ff:ff:ff:ff:ff)
        Address: Broadcast (ff:ff:ff:ff:ff:ff)
        .... ..1. .... .... .... .... = LG bit: Locally administered address (this is NOT the factory default)
        .... ...1 .... .... .... .... = IG bit: Group address (multicast/broadcast)
    Source: ARRISGro_eb:7e:bf (98:6b:3d:eb:7e:bf)
        Address: ARRISGro_eb:7e:bf (98:6b:3d:eb:7e:bf)
        .... ..0. .... .... .... .... = LG bit: Globally unique address (factory default)
        .... ...0 .... .... .... .... = IG bit: Individual address (unicast)
    Type: Realtek Layer 2 Protocols (0x8899)
Data (46 bytes)

0000  23 25 36 66 a1 41 5f 00 00 00 00 00 00 03 00 00   #%6f.A_.........
0010  00 00 00 00 00 00 00 00 00 00 00 00 00 00 00 00   ................
0020  00 00 00 00 00 00 00 00 00 00 00 00 00 00         ..............
    Data: 23253666a1415f0000000000000300000000000000000000000000000000000000000000…
    [Length: 46]

Frame 6: 216 bytes on wire (1728 bits), 216 bytes captured (1728 bits) on interface en0, id 0
    Interface id: 0 (en0)
        Interface name: en0
        Interface description: Wi-Fi
    Encapsulation type: Ethernet (1)
    Arrival Time: Jul 20, 2021 19:24:08.079591000 EDT
    [Time shift for this packet: 0.000000000 seconds]
    Epoch Time: 1626823448.079591000 seconds
    [Time delta from previous captured frame: 0.205001000 seconds]
    [Time delta from previous displayed frame: 0.205001000 seconds]
    [Time since reference or first frame: 0.819616000 seconds]
    Frame Number: 6
    Frame Length: 216 bytes (1728 bits)
    Capture Length: 216 bytes (1728 bits)
    [Frame is marked: False]
    [Frame is ignored: False]
    [Protocols in frame: eth:ethertype:ip:udp:data]
Ethernet II, Src: Espressi_e3:84:28 (68:c6:3a:e3:84:28), Dst: Broadcast (ff:ff:ff:ff:ff:ff)
    Destination: Broadcast (ff:ff:ff:ff:ff:ff)
        Address: Broadcast (ff:ff:ff:ff:ff:ff)
        .... ..1. .... .... .... .... = LG bit: Locally administered address (this is NOT the factory default)
        .... ...1 .... .... .... .... = IG bit: Group address (multicast/broadcast)
    Source: Espressi_e3:84:28 (68:c6:3a:e3:84:28)
        Address: Espressi_e3:84:28 (68:c6:3a:e3:84:28)
        .... ..0. .... .... .... .... = LG bit: Globally unique address (factory default)
        .... ...0 .... .... .... .... = IG bit: Individual address (unicast)
    Type: IPv4 (0x0800)
Internet Protocol Version 4, Src: 192.168.0.84, Dst: 255.255.255.255
    0100 .... = Version: 4
    .... 0101 = Header Length: 20 bytes (5)
    Differentiated Services Field: 0x00 (DSCP: CS0, ECN: Not-ECT)
        0000 00.. = Differentiated Services Codepoint: Default (0)
        .... ..00 = Explicit Congestion Notification: Not ECN-Capable Transport (0)
    Total Length: 202
    Identification: 0xde6f (56943)
    Flags: 0x00
        0... .... = Reserved bit: Not set
        .0.. .... = Don't fragment: Not set
        ..0. .... = More fragments: Not set
    Fragment Offset: 0
    Time to Live: 255
    Protocol: UDP (17)
    Header Checksum: 0x1bb7 [validation disabled]
    [Header checksum status: Unverified]
    Source Address: 192.168.0.84
    Destination Address: 255.255.255.255
User Datagram Protocol, Src Port: 49154, Dst Port: 6666
    Source Port: 49154
    Destination Port: 6666
    Length: 182
    Checksum: 0xeeb4 [unverified]
    [Checksum Status: Unverified]
    [Stream index: 3]
    [Timestamps]
        [Time since first frame: 0.000000000 seconds]
        [Time since previous frame: 0.000000000 seconds]
    UDP payload (174 bytes)
Data (174 bytes)

0000  00 00 55 aa 00 00 00 00 00 00 00 00 00 00 00 9e   ..U.............
0010  00 00 00 00 7b 22 69 70 22 3a 22 31 39 32 2e 31   ....{"ip":"192.1
0020  36 38 2e 30 2e 38 34 22 2c 22 67 77 49 64 22 3a   68.0.84","gwId":
0030  22 32 35 32 30 30 33 31 30 36 38 63 36 33 61 65   "2520031068c63ae
0040  33 38 34 32 38 22 2c 22 61 63 74 69 76 65 22 3a   38428","active":
0050  32 2c 22 61 62 69 6c 69 74 79 22 3a 30 2c 22 6d   2,"ability":0,"m
0060  6f 64 65 22 3a 30 2c 22 65 6e 63 72 79 70 74 22   ode":0,"encrypt"
0070  3a 74 72 75 65 2c 22 70 72 6f 64 75 63 74 4b 65   :true,"productKe
0080  79 22 3a 22 6b 65 79 33 34 6e 39 79 6d 75 33 79   y":"key34n9ymu3y
0090  6d 63 78 33 22 2c 22 76 65 72 73 69 6f 6e 22 3a   mcx3","version":
00a0  22 33 2e 31 22 7d d6 93 eb 91 00 00 aa 55         "3.1"}.......U
    Data: 000055aa00000000000000000000009e000000007b226970223a223139322e3136382e30…
    [Length: 174]

Frame 7: 216 bytes on wire (1728 bits), 216 bytes captured (1728 bits) on interface en0, id 0
    Interface id: 0 (en0)
        Interface name: en0
        Interface description: Wi-Fi
    Encapsulation type: Ethernet (1)
    Arrival Time: Jul 20, 2021 19:24:08.079641000 EDT
    [Time shift for this packet: 0.000000000 seconds]
    Epoch Time: 1626823448.079641000 seconds
    [Time delta from previous captured frame: 0.000050000 seconds]
    [Time delta from previous displayed frame: 0.000050000 seconds]
    [Time since reference or first frame: 0.819666000 seconds]
    Frame Number: 7
    Frame Length: 216 bytes (1728 bits)
    Capture Length: 216 bytes (1728 bits)
    [Frame is marked: False]
    [Frame is ignored: False]
    [Protocols in frame: eth:ethertype:ip:udp:data]
Ethernet II, Src: Espressi_e2:d7:f6 (68:c6:3a:e2:d7:f6), Dst: Broadcast (ff:ff:ff:ff:ff:ff)
    Destination: Broadcast (ff:ff:ff:ff:ff:ff)
        Address: Broadcast (ff:ff:ff:ff:ff:ff)
        .... ..1. .... .... .... .... = LG bit: Locally administered address (this is NOT the factory default)
        .... ...1 .... .... .... .... = IG bit: Group address (multicast/broadcast)
    Source: Espressi_e2:d7:f6 (68:c6:3a:e2:d7:f6)
        Address: Espressi_e2:d7:f6 (68:c6:3a:e2:d7:f6)
        .... ..0. .... .... .... .... = LG bit: Globally unique address (factory default)
        .... ...0 .... .... .... .... = IG bit: Individual address (unicast)
    Type: IPv4 (0x0800)
Internet Protocol Version 4, Src: 192.168.0.83, Dst: 255.255.255.255
    0100 .... = Version: 4
    .... 0101 = Header Length: 20 bytes (5)
    Differentiated Services Field: 0x00 (DSCP: CS0, ECN: Not-ECT)
        0000 00.. = Differentiated Services Codepoint: Default (0)
        .... ..00 = Explicit Congestion Notification: Not ECN-Capable Transport (0)
    Total Length: 202
    Identification: 0xe1d7 (57815)
    Flags: 0x00
        0... .... = Reserved bit: Not set
        .0.. .... = Don't fragment: Not set
        ..0. .... = More fragments: Not set
    Fragment Offset: 0
    Time to Live: 255
    Protocol: UDP (17)
    Header Checksum: 0x1850 [validation disabled]
    [Header checksum status: Unverified]
    Source Address: 192.168.0.83
    Destination Address: 255.255.255.255
User Datagram Protocol, Src Port: 49154, Dst Port: 6666
    Source Port: 49154
    Destination Port: 6666
    Length: 182
    Checksum: 0x14d7 [unverified]
    [Checksum Status: Unverified]
    [Stream index: 4]
    [Timestamps]
        [Time since first frame: 0.000000000 seconds]
        [Time since previous frame: 0.000000000 seconds]
    UDP payload (174 bytes)
Data (174 bytes)

0000  00 00 55 aa 00 00 00 00 00 00 00 00 00 00 00 9e   ..U.............
0010  00 00 00 00 7b 22 69 70 22 3a 22 31 39 32 2e 31   ....{"ip":"192.1
0020  36 38 2e 30 2e 38 33 22 2c 22 67 77 49 64 22 3a   68.0.83","gwId":
0030  22 32 35 32 30 30 33 31 30 36 38 63 36 33 61 65   "2520031068c63ae
0040  32 64 37 66 36 22 2c 22 61 63 74 69 76 65 22 3a   2d7f6","active":
0050  32 2c 22 61 62 69 6c 69 74 79 22 3a 30 2c 22 6d   2,"ability":0,"m
0060  6f 64 65 22 3a 30 2c 22 65 6e 63 72 79 70 74 22   ode":0,"encrypt"
0070  3a 74 72 75 65 2c 22 70 72 6f 64 75 63 74 4b 65   :true,"productKe
0080  79 22 3a 22 6b 65 79 33 34 6e 39 79 6d 75 33 79   y":"key34n9ymu3y
0090  6d 63 78 33 22 2c 22 76 65 72 73 69 6f 6e 22 3a   mcx3","version":
00a0  22 33 2e 31 22 7d 85 fe 16 a6 00 00 aa 55         "3.1"}.......U
    Data: 000055aa00000000000000000000009e000000007b226970223a223139322e3136382e30…
    [Length: 174]

Frame 8: 138 bytes on wire (1104 bits), 138 bytes captured (1104 bits) on interface en0, id 0
    Interface id: 0 (en0)
        Interface name: en0
        Interface description: Wi-Fi
    Encapsulation type: Ethernet (1)
    Arrival Time: Jul 20, 2021 19:24:08.080317000 EDT
    [Time shift for this packet: 0.000000000 seconds]
    Epoch Time: 1626823448.080317000 seconds
    [Time delta from previous captured frame: 0.000676000 seconds]
    [Time delta from previous displayed frame: 0.000676000 seconds]
    [Time since reference or first frame: 0.820342000 seconds]
    Frame Number: 8
    Frame Length: 138 bytes (1104 bits)
    Capture Length: 138 bytes (1104 bits)
    [Frame is marked: False]
    [Frame is ignored: False]
    [Protocols in frame: eth:ethertype:ipv6:tcp:data]
Ethernet II, Src: ARRISGro_eb:7e:b7 (98:6b:3d:eb:7e:b7), Dst: Apple_99:9f:a4 (d0:e1:40:99:9f:a4)
    Destination: Apple_99:9f:a4 (d0:e1:40:99:9f:a4)
        Address: Apple_99:9f:a4 (d0:e1:40:99:9f:a4)
        .... ..0. .... .... .... .... = LG bit: Globally unique address (factory default)
        .... ...0 .... .... .... .... = IG bit: Individual address (unicast)
    Source: ARRISGro_eb:7e:b7 (98:6b:3d:eb:7e:b7)
        Address: ARRISGro_eb:7e:b7 (98:6b:3d:eb:7e:b7)
        .... ..0. .... .... .... .... = LG bit: Globally unique address (factory default)
        .... ...0 .... .... .... .... = IG bit: Individual address (unicast)
    Type: IPv6 (0x86dd)
Internet Protocol Version 6, Src: 2001:67c:2564:ac33:da5d:4cff:fe80:9a66, Dst: 2603:7000:7e07:fc00:4de7:a20a:2b16:f9a
    0110 .... = Version: 6
    .... 0000 0000 .... .... .... .... .... = Traffic Class: 0x00 (DSCP: CS0, ECN: Not-ECT)
        .... 0000 00.. .... .... .... .... .... = Differentiated Services Codepoint: Default (0)
        .... .... ..00 .... .... .... .... .... = Explicit Congestion Notification: Not ECN-Capable Transport (0)
    .... .... .... 1110 0010 1110 0110 1110 = Flow Label: 0xe2e6e
    Payload Length: 84
    Next Header: TCP (6)
    Hop Limit: 48
    Source Address: 2001:67c:2564:ac33:da5d:4cff:fe80:9a66
    Destination Address: 2603:7000:7e07:fc00:4de7:a20a:2b16:f9a
    [Source SA MAC: Tp-LinkT_80:9a:66 (d8:5d:4c:80:9a:66)]
Transmission Control Protocol, Src Port: 8901, Dst Port: 64806, Seq: 1, Ack: 1, Len: 52
    Source Port: 8901
    Destination Port: 64806
    [Stream index: 0]
    [TCP Segment Len: 52]
    Sequence Number: 1    (relative sequence number)
    Sequence Number (raw): 716125264
    [Next Sequence Number: 53    (relative sequence number)]
    Acknowledgment Number: 1    (relative ack number)
    Acknowledgment number (raw): 2748761721
    1000 .... = Header Length: 32 bytes (8)
    Flags: 0x018 (PSH, ACK)
        000. .... .... = Reserved: Not set
        ...0 .... .... = Nonce: Not set
        .... 0... .... = Congestion Window Reduced (CWR): Not set
        .... .0.. .... = ECN-Echo: Not set
        .... ..0. .... = Urgent: Not set
        .... ...1 .... = Acknowledgment: Set
        .... .... 1... = Push: Set
        .... .... .0.. = Reset: Not set
        .... .... ..0. = Syn: Not set
        .... .... ...0 = Fin: Not set
        [TCP Flags: ·······AP···]
    Window: 59
    [Calculated window size: 59]
    [Window size scaling factor: -1 (unknown)]
    Checksum: 0x293d [unverified]
    [Checksum Status: Unverified]
    Urgent Pointer: 0
    Options: (12 bytes), No-Operation (NOP), No-Operation (NOP), Timestamps
        TCP Option - No-Operation (NOP)
            Kind: No-Operation (1)
        TCP Option - No-Operation (NOP)
            Kind: No-Operation (1)
        TCP Option - Timestamps: TSval 2175246370, TSecr 573106211
            Kind: Time Stamp Option (8)
            Length: 10
            Timestamp value: 2175246370
            Timestamp echo reply: 573106211
    [SEQ/ACK analysis]
        [Bytes in flight: 52]
        [Bytes sent since last PSH flag: 52]
    [Timestamps]
        [Time since first frame in this TCP stream: 0.000000000 seconds]
        [Time since previous frame in this TCP stream: 0.000000000 seconds]
    TCP payload (52 bytes)
Data (52 bytes)

0000  64 61 74 61 3a 20 5b 5b 32 2c 32 36 31 37 30 36   data: [[2,261706
0010  37 36 5d 2c 5b 35 2c 31 30 38 2c 30 2e 31 33 39   76],[5,108,0.139
0020  31 36 30 5d 5d 0a 69 64 3a 20 32 36 31 37 30 36   160]].id: 261706
0030  37 36 0a 0a                                       76..
    Data: 646174613a205b5b322c32363137303637365d2c5b352c3130382c302e3133393136305d…
    [Length: 52]

Frame 9: 86 bytes on wire (688 bits), 86 bytes captured (688 bits) on interface en0, id 0
    Interface id: 0 (en0)
        Interface name: en0
        Interface description: Wi-Fi
    Encapsulation type: Ethernet (1)
    Arrival Time: Jul 20, 2021 19:24:08.080427000 EDT
    [Time shift for this packet: 0.000000000 seconds]
    Epoch Time: 1626823448.080427000 seconds
    [Time delta from previous captured frame: 0.000110000 seconds]
    [Time delta from previous displayed frame: 0.000110000 seconds]
    [Time since reference or first frame: 0.820452000 seconds]
    Frame Number: 9
    Frame Length: 86 bytes (688 bits)
    Capture Length: 86 bytes (688 bits)
    [Frame is marked: False]
    [Frame is ignored: False]
    [Protocols in frame: eth:ethertype:ipv6:tcp]
Ethernet II, Src: Apple_99:9f:a4 (d0:e1:40:99:9f:a4), Dst: ARRISGro_eb:7e:b7 (98:6b:3d:eb:7e:b7)
    Destination: ARRISGro_eb:7e:b7 (98:6b:3d:eb:7e:b7)
        Address: ARRISGro_eb:7e:b7 (98:6b:3d:eb:7e:b7)
        .... ..0. .... .... .... .... = LG bit: Globally unique address (factory default)
        .... ...0 .... .... .... .... = IG bit: Individual address (unicast)
    Source: Apple_99:9f:a4 (d0:e1:40:99:9f:a4)
        Address: Apple_99:9f:a4 (d0:e1:40:99:9f:a4)
        .... ..0. .... .... .... .... = LG bit: Globally unique address (factory default)
        .... ...0 .... .... .... .... = IG bit: Individual address (unicast)
    Type: IPv6 (0x86dd)
Internet Protocol Version 6, Src: 2603:7000:7e07:fc00:4de7:a20a:2b16:f9a, Dst: 2001:67c:2564:ac33:da5d:4cff:fe80:9a66
    0110 .... = Version: 6
    .... 0000 0000 .... .... .... .... .... = Traffic Class: 0x00 (DSCP: CS0, ECN: Not-ECT)
        .... 0000 00.. .... .... .... .... .... = Differentiated Services Codepoint: Default (0)
        .... .... ..00 .... .... .... .... .... = Explicit Congestion Notification: Not ECN-Capable Transport (0)
    .... .... .... 0101 1100 1011 1010 0001 = Flow Label: 0x5cba1
    Payload Length: 32
    Next Header: TCP (6)
    Hop Limit: 64
    Source Address: 2603:7000:7e07:fc00:4de7:a20a:2b16:f9a
    Destination Address: 2001:67c:2564:ac33:da5d:4cff:fe80:9a66
    [Destination SA MAC: Tp-LinkT_80:9a:66 (d8:5d:4c:80:9a:66)]
Transmission Control Protocol, Src Port: 64806, Dst Port: 8901, Seq: 1, Ack: 53, Len: 0
    Source Port: 64806
    Destination Port: 8901
    [Stream index: 0]
    [TCP Segment Len: 0]
    Sequence Number: 1    (relative sequence number)
    Sequence Number (raw): 2748761721
    [Next Sequence Number: 1    (relative sequence number)]
    Acknowledgment Number: 53    (relative ack number)
    Acknowledgment number (raw): 716125316
    1000 .... = Header Length: 32 bytes (8)
    Flags: 0x010 (ACK)
        000. .... .... = Reserved: Not set
        ...0 .... .... = Nonce: Not set
        .... 0... .... = Congestion Window Reduced (CWR): Not set
        .... .0.. .... = ECN-Echo: Not set
        .... ..0. .... = Urgent: Not set
        .... ...1 .... = Acknowledgment: Set
        .... .... 0... = Push: Not set
        .... .... .0.. = Reset: Not set
        .... .... ..0. = Syn: Not set
        .... .... ...0 = Fin: Not set
        [TCP Flags: ·······A····]
    Window: 4094
    [Calculated window size: 4094]
    [Window size scaling factor: -1 (unknown)]
    Checksum: 0x5a25 [unverified]
    [Checksum Status: Unverified]
    Urgent Pointer: 0
    Options: (12 bytes), No-Operation (NOP), No-Operation (NOP), Timestamps
        TCP Option - No-Operation (NOP)
            Kind: No-Operation (1)
        TCP Option - No-Operation (NOP)
            Kind: No-Operation (1)
        TCP Option - Timestamps: TSval 573107248, TSecr 2175246370
            Kind: Time Stamp Option (8)
            Length: 10
            Timestamp value: 573107248
            Timestamp echo reply: 2175246370
    [SEQ/ACK analysis]
        [This is an ACK to the segment in frame: 8]
        [The RTT to ACK the segment was: 0.000110000 seconds]
    [Timestamps]
        [Time since first frame in this TCP stream: 0.000110000 seconds]
        [Time since previous frame in this TCP stream: 0.000110000 seconds]

Frame 10: 92 bytes on wire (736 bits), 92 bytes captured (736 bits) on interface en0, id 0
    Interface id: 0 (en0)
        Interface name: en0
        Interface description: Wi-Fi
    Encapsulation type: Ethernet (1)
    Arrival Time: Jul 20, 2021 19:24:08.284129000 EDT
    [Time shift for this packet: 0.000000000 seconds]
    Epoch Time: 1626823448.284129000 seconds
    [Time delta from previous captured frame: 0.203702000 seconds]
    [Time delta from previous displayed frame: 0.203702000 seconds]
    [Time since reference or first frame: 1.024154000 seconds]
    Frame Number: 10
    Frame Length: 92 bytes (736 bits)
    Capture Length: 92 bytes (736 bits)
    [Frame is marked: False]
    [Frame is ignored: False]
    [Protocols in frame: eth:ethertype:ip:udp:data]
Ethernet II, Src: Micro-St_d3:1f:05 (00:d8:61:d3:1f:05), Dst: IPv4mcast_01 (01:00:5e:00:00:01)
    Destination: IPv4mcast_01 (01:00:5e:00:00:01)
        Address: IPv4mcast_01 (01:00:5e:00:00:01)
        .... ..0. .... .... .... .... = LG bit: Globally unique address (factory default)
        .... ...1 .... .... .... .... = IG bit: Group address (multicast/broadcast)
    Source: Micro-St_d3:1f:05 (00:d8:61:d3:1f:05)
        Address: Micro-St_d3:1f:05 (00:d8:61:d3:1f:05)
        .... ..0. .... .... .... .... = LG bit: Globally unique address (factory default)
        .... ...0 .... .... .... .... = IG bit: Individual address (unicast)
    Type: IPv4 (0x0800)
Internet Protocol Version 4, Src: 192.168.0.69, Dst: 230.0.0.1
    0100 .... = Version: 4
    .... 0101 = Header Length: 20 bytes (5)
    Differentiated Services Field: 0x00 (DSCP: CS0, ECN: Not-ECT)
        0000 00.. = Differentiated Services Codepoint: Default (0)
        .... ..00 = Explicit Congestion Notification: Not ECN-Capable Transport (0)
    Total Length: 78
    Identification: 0xf44a (62538)
    Flags: 0x00
        0... .... = Reserved bit: Not set
        .0.. .... = Don't fragment: Not set
        ..0. .... = More fragments: Not set
    Fragment Offset: 0
    Time to Live: 1
    Protocol: UDP (17)
    Header Checksum: 0x1e66 [validation disabled]
    [Header checksum status: Unverified]
    Source Address: 192.168.0.69
    Destination Address: 230.0.0.1
User Datagram Protocol, Src Port: 58956, Dst Port: 6666
    Source Port: 58956
    Destination Port: 6666
    Length: 58
    Checksum: 0x7b5e [unverified]
    [Checksum Status: Unverified]
    [Stream index: 0]
    [Timestamps]
        [Time since first frame: 1.024154000 seconds]
        [Time since previous frame: 1.024154000 seconds]
    UDP payload (50 bytes)
Data (50 bytes)
        0... .... = Reserved bit: Not set
        .0.. .... = Don't fragment: Not set
        ..0. .... = More fragments: Not set
    Fragment Offset: 0
    Time to Live: 255
    Protocol: UDP (17)
    Header Checksum: 0x755f [validation disabled]
    [Header checksum status: Unverified]
    Source Address: 192.168.0.71
    Destination Address: 255.255.255.255
User Datagram Protocol, Src Port: 49154, Dst Port: 6667
    Source Port: 49154
    Destination Port: 6667
    Length: 196
    Checksum: 0xfae0 [unverified]
    [Checksum Status: Unverified]
    [Stream index: 18]
    [Timestamps]
        [Time since first frame: 10.035620000 seconds]
        [Time since previous frame: 4.914819000 seconds]
    UDP payload (188 bytes)
Data (188 bytes)

0000  00 00 55 aa 00 00 00 00 00 00 00 13 00 00 00 ac   ..U.............
0010  00 00 00 00 23 d0 1e 5f ef 56 83 33 14 ce f6 0f   ....#.._.V.3....
0020  b0 86 ed 33 08 0a d7 d7 02 70 d5 c6 22 1f 17 ab   ...3.....p.."...
0030  7c e5 b8 86 20 20 a9 8b 46 f9 2f 40 a6 f5 c4 c5   |...  ..F./@....
0040  8c c5 38 c2 5c fb 60 c6 9b 9e 66 05 8a 7c ca 02   ..8.\.`...f..|..
0050  3c d5 d3 a4 cb 59 24 bb 87 92 fe 5e ae 7c 90 40   <....Y$....^.|.@
0060  e5 92 1a 98 01 7f 21 70 86 04 21 e6 fc 66 f0 a1   ......!p..!..f..
0070  ad e1 38 91 5f de 85 0c d1 57 27 0c 5f 3d 1a b5   ..8._....W'._=..
0080  ae 90 b3 00 29 01 0d 91 a3 d5 d6 b1 d8 f5 f7 e3   ....)...........
0090  d7 d8 70 d8 1c 83 43 bc 25 f3 40 3c 0c 4c 3d b5   ..p...C.%.@<.L=.
00a0  93 50 d3 4a e0 bd 1f 2c ba d7 05 88 6d 4e d8 ee   .P.J...,....mN..
00b0  d5 ab 9e b9 a2 3d e2 ae 00 00 aa 55               .....=.....U
    Data: 000055aa0000000000000013000000ac0000000023d01e5fef56833314cef60fb086ed33…
    [Length: 188]

