Frame 1: 87 bytes on wire (696 bits), 87 bytes captured (696 bits) on interface en0, id 0
    Interface id: 0 (en0)
        Interface name: en0
        Interface description: Wi-Fi
    Encapsulation type: Ethernet (1)
    Arrival Time: Jul 25, 2021 17:55:02.407146000 EDT
    [Time shift for this packet: 0.000000000 seconds]
    Epoch Time: 1627250102.407146000 seconds
    [Time delta from previous captured frame: 0.000000000 seconds]
    [Time delta from previous displayed frame: 0.000000000 seconds]
    [Time since reference or first frame: 0.000000000 seconds]
    Frame Number: 1
    Frame Length: 87 bytes (696 bits)
    Capture Length: 87 bytes (696 bits)
    [Frame is marked: False]
    [Frame is ignored: False]
    [Protocols in frame: eth:ethertype:ipv6:udp:data]
Ethernet II, Src: ARRISGro_eb:7e:b7 (98:6b:3d:eb:7e:b7), Dst: Apple_99:9f:a4 (d0:e1:40:99:9f:a4)
    Destination: Apple_99:9f:a4 (d0:e1:40:99:9f:a4)
        Address: Apple_99:9f:a4 (d0:e1:40:99:9f:a4)
        .... ..0. .... .... .... .... = LG bit: Globally unique address (factory default)
        .... ...0 .... .... .... .... = IG bit: Individual address (unicast)
    Source: ARRISGro_eb:7e:b7 (98:6b:3d:eb:7e:b7)
        Address: ARRISGro_eb:7e:b7 (98:6b:3d:eb:7e:b7)
        .... ..0. .... .... .... .... = LG bit: Globally unique address (factory default)
        .... ...0 .... .... .... .... = IG bit: Individual address (unicast)
    Type: IPv6 (0x86dd)
Internet Protocol Version 6, Src: 2607:f8b0:4023:1004::bd, Dst: 2603:7000:7e07:fc00:8092:e100:adf7:53e2
    0110 .... = Version: 6
    .... 0000 0000 .... .... .... .... .... = Traffic Class: 0x00 (DSCP: CS0, ECN: Not-ECT)
        .... 0000 00.. .... .... .... .... .... = Differentiated Services Codepoint: Default (0)
        .... .... ..00 .... .... .... .... .... = Explicit Congestion Notification: Not ECN-Capable Transport (0)
    .... .... .... 0000 0000 0000 0000 0000 = Flow Label: 0x00000
    Payload Length: 33
    Next Header: UDP (17)
    Hop Limit: 56
    Source Address: 2607:f8b0:4023:1004::bd
    Destination Address: 2603:7000:7e07:fc00:8092:e100:adf7:53e2
User Datagram Protocol, Src Port: 443, Dst Port: 60097
    Source Port: 443
    Destination Port: 60097
    Length: 33
    Checksum: 0x7ddf [unverified]
    [Checksum Status: Unverified]
    [Stream index: 0]
    [Timestamps]
        [Time since first frame: 0.000000000 seconds]
        [Time since previous frame: 0.000000000 seconds]
    UDP payload (25 bytes)
Data (25 bytes)

0000  4f 13 33 fb 6f 25 19 f6 e4 b0 cf 63 7d c8 5e e4   O.3.o%.....c}.^.
0010  0a a7 ef 44 b5 ca aa 97 bb                        ...D.....
    Data: 4f1333fb6f2519f6e4b0cf637dc85ee40aa7ef44b5caaa97bb
    [Length: 25]

Frame 2: 230 bytes on wire (1840 bits), 230 bytes captured (1840 bits) on interface en0, id 0
    Interface id: 0 (en0)
        Interface name: en0
        Interface description: Wi-Fi
    Encapsulation type: Ethernet (1)
    Arrival Time: Jul 25, 2021 17:55:02.489703000 EDT
    [Time shift for this packet: 0.000000000 seconds]
    Epoch Time: 1627250102.489703000 seconds
    [Time delta from previous captured frame: 0.082557000 seconds]
    [Time delta from previous displayed frame: 0.082557000 seconds]
    [Time since reference or first frame: 0.082557000 seconds]
    Frame Number: 2
    Frame Length: 230 bytes (1840 bits)
    Capture Length: 230 bytes (1840 bits)
    [Frame is marked: False]
    [Frame is ignored: False]
    [Protocols in frame: eth:ethertype:ip:udp:data]
Ethernet II, Src: Espressi_18:f2:13 (c4:dd:57:18:f2:13), Dst: Broadcast (ff:ff:ff:ff:ff:ff)
    Destination: Broadcast (ff:ff:ff:ff:ff:ff)
        Address: Broadcast (ff:ff:ff:ff:ff:ff)
        .... ..1. .... .... .... .... = LG bit: Locally administered address (this is NOT the factory default)
        .... ...1 .... .... .... .... = IG bit: Group address (multicast/broadcast)
    Source: Espressi_18:f2:13 (c4:dd:57:18:f2:13)
        Address: Espressi_18:f2:13 (c4:dd:57:18:f2:13)
        .... ..0. .... .... .... .... = LG bit: Globally unique address (factory default)
        .... ...0 .... .... .... .... = IG bit: Individual address (unicast)
    Type: IPv4 (0x0800)
Internet Protocol Version 4, Src: 192.168.0.57, Dst: 255.255.255.255
    0100 .... = Version: 4
    .... 0101 = Header Length: 20 bytes (5)
    Differentiated Services Field: 0x00 (DSCP: CS0, ECN: Not-ECT)
        0000 00.. = Differentiated Services Codepoint: Default (0)
        .... ..00 = Explicit Congestion Notification: Not ECN-Capable Transport (0)
    Total Length: 216
    Identification: 0x9e2e (40494)
    Flags: 0x00
        0... .... = Reserved bit: Not set
        .0.. .... = Don't fragment: Not set
        ..0. .... = More fragments: Not set
    Fragment Offset: 0
    Time to Live: 255
    Protocol: UDP (17)
    Header Checksum: 0x5c05 [validation disabled]
    [Header checksum status: Unverified]
    Source Address: 192.168.0.57
    Destination Address: 255.255.255.255
User Datagram Protocol, Src Port: 49154, Dst Port: 6667
    Source Port: 49154
    Destination Port: 6667
    Length: 196
    Checksum: 0x3a79 [unverified]
    [Checksum Status: Unverified]
    [Stream index: 1]
    [Timestamps]
        [Time since first frame: 0.000000000 seconds]
        [Time since previous frame: 0.000000000 seconds]
    UDP payload (188 bytes)
Data (188 bytes)

0000  00 00 55 aa 00 00 00 00 00 00 00 13 00 00 00 ac   ..U.............
0010  00 00 00 00 23 d0 1e 5f ef 56 83 33 14 ce f6 0f   ....#.._.V.3....
0020  b0 86 ed 33 8d b2 88 c3 ae 16 9c ef 03 88 71 7a   ...3..........qz
0030  da 42 45 ae 75 5a a8 ec 6b 49 0d 43 dd fb de 62   .BE.uZ..kI.C...b
0040  bf 4e c0 35 e8 39 11 b7 f2 10 22 d7 80 d2 0d ad   .N.5.9....".....
0050  53 2a 00 ed cb 59 24 bb 87 92 fe 5e ae 7c 90 40   S*...Y$....^.|.@
0060  e5 92 1a 98 01 7f 21 70 86 04 21 e6 fc 66 f0 a1   ......!p..!..f..
0070  ad e1 38 91 5f de 85 0c d1 57 27 0c 5f 3d 1a b5   ..8._....W'._=..
0080  ae 90 b3 00 29 01 0d 91 a3 d5 d6 b1 d8 f5 f7 e3   ....)...........
0090  d7 d8 70 d8 1c 83 43 bc 25 f3 40 3c 0c 4c 3d b5   ..p...C.%.@<.L=.
00a0  93 50 d3 4a e0 bd 1f 2c ba d7 05 88 6d 4e d8 ee   .P.J...,....mN..
00b0  d5 ab 9e b9 49 86 fe 1b 00 00 aa 55               ....I......U
    Data: 000055aa0000000000000013000000ac0000000023d01e5fef56833314cef60fb086ed33…
    [Length: 188]

Frame 3: 216 bytes on wire (1728 bits), 216 bytes captured (1728 bits) on interface en0, id 0
    Interface id: 0 (en0)
        Interface name: en0
        Interface description: Wi-Fi
    Encapsulation type: Ethernet (1)
    Arrival Time: Jul 25, 2021 17:55:02.490229000 EDT
    [Time shift for this packet: 0.000000000 seconds]
    Epoch Time: 1627250102.490229000 seconds
    [Time delta from previous captured frame: 0.000526000 seconds]
    [Time delta from previous displayed frame: 0.000526000 seconds]
    [Time since reference or first frame: 0.083083000 seconds]
    Frame Number: 3
    Frame Length: 216 bytes (1728 bits)
    Capture Length: 216 bytes (1728 bits)
    [Frame is marked: False]
    [Frame is ignored: False]
    [Protocols in frame: eth:ethertype:ip:udp:data]
Ethernet II, Src: Espressi_e2:d7:f6 (68:c6:3a:e2:d7:f6), Dst: Broadcast (ff:ff:ff:ff:ff:ff)
    Destination: Broadcast (ff:ff:ff:ff:ff:ff)
        Address: Broadcast (ff:ff:ff:ff:ff:ff)
        .... ..1. .... .... .... .... = LG bit: Locally administered address (this is NOT the factory default)
        .... ...1 .... .... .... .... = IG bit: Group address (multicast/broadcast)
    Source: Espressi_e2:d7:f6 (68:c6:3a:e2:d7:f6)
        Address: Espressi_e2:d7:f6 (68:c6:3a:e2:d7:f6)
        .... ..0. .... .... .... .... = LG bit: Globally unique address (factory default)
        .... ...0 .... .... .... .... = IG bit: Individual address (unicast)
    Type: IPv4 (0x0800)
Internet Protocol Version 4, Src: 192.168.0.83, Dst: 255.255.255.255
    0100 .... = Version: 4
    .... 0101 = Header Length: 20 bytes (5)
    Differentiated Services Field: 0x00 (DSCP: CS0, ECN: Not-ECT)
        0000 00.. = Differentiated Services Codepoint: Default (0)
        .... ..00 = Explicit Congestion Notification: Not ECN-Capable Transport (0)
    Total Length: 202
    Identification: 0x4681 (18049)
    Flags: 0x00
        0... .... = Reserved bit: Not set
        .0.. .... = Don't fragment: Not set
        ..0. .... = More fragments: Not set
    Fragment Offset: 0
    Time to Live: 255
    Protocol: UDP (17)
    Header Checksum: 0xb3a6 [validation disabled]
    [Header checksum status: Unverified]
    Source Address: 192.168.0.83
    Destination Address: 255.255.255.255
User Datagram Protocol, Src Port: 49154, Dst Port: 6666
    Source Port: 49154
    Destination Port: 6666
    Length: 182
    Checksum: 0x14d7 [unverified]
    [Checksum Status: Unverified]
    [Stream index: 2]
    [Timestamps]
        [Time since first frame: 0.000000000 seconds]
        [Time since previous frame: 0.000000000 seconds]
    UDP payload (174 bytes)
Data (174 bytes)

0000  00 00 55 aa 00 00 00 00 00 00 00 00 00 00 00 9e   ..U.............
0010  00 00 00 00 7b 22 69 70 22 3a 22 31 39 32 2e 31   ....{"ip":"192.1
0020  36 38 2e 30 2e 38 33 22 2c 22 67 77 49 64 22 3a   68.0.83","gwId":
0030  22 32 35 32 30 30 33 31 30 36 38 63 36 33 61 65   "2520031068c63ae
0040  32 64 37 66 36 22 2c 22 61 63 74 69 76 65 22 3a   2d7f6","active":
0050  32 2c 22 61 62 69 6c 69 74 79 22 3a 30 2c 22 6d   2,"ability":0,"m
0060  6f 64 65 22 3a 30 2c 22 65 6e 63 72 79 70 74 22   ode":0,"encrypt"
0070  3a 74 72 75 65 2c 22 70 72 6f 64 75 63 74 4b 65   :true,"productKe
0080  79 22 3a 22 6b 65 79 33 34 6e 39 79 6d 75 33 79   y":"key34n9ymu3y
0090  6d 63 78 33 22 2c 22 76 65 72 73 69 6f 6e 22 3a   mcx3","version":
00a0  22 33 2e 31 22 7d 85 fe 16 a6 00 00 aa 55         "3.1"}.......U
    Data: 000055aa00000000000000000000009e000000007b226970223a223139322e3136382e30…
    [Length: 174]

Frame 4: 95 bytes on wire (760 bits), 95 bytes captured (760 bits) on interface en0, id 0
    Interface id: 0 (en0)
        Interface name: en0
        Interface description: Wi-Fi
    Encapsulation type: Ethernet (1)
    Arrival Time: Jul 25, 2021 17:55:02.496324000 EDT
    [Time shift for this packet: 0.000000000 seconds]
    Epoch Time: 1627250102.496324000 seconds
    [Time delta from previous captured frame: 0.006095000 seconds]
    [Time delta from previous displayed frame: 0.006095000 seconds]
    [Time since reference or first frame: 0.089178000 seconds]
    Frame Number: 4
    Frame Length: 95 bytes (760 bits)
    Capture Length: 95 bytes (760 bits)
    [Frame is marked: False]
    [Frame is ignored: False]
    [Protocols in frame: eth:ethertype:ipv6:udp:data]
Ethernet II, Src: Apple_99:9f:a4 (d0:e1:40:99:9f:a4), Dst: ARRISGro_eb:7e:b7 (98:6b:3d:eb:7e:b7)
    Destination: ARRISGro_eb:7e:b7 (98:6b:3d:eb:7e:b7)
        Address: ARRISGro_eb:7e:b7 (98:6b:3d:eb:7e:b7)
        .... ..0. .... .... .... .... = LG bit: Globally unique address (factory default)
        .... ...0 .... .... .... .... = IG bit: Individual address (unicast)
    Source: Apple_99:9f:a4 (d0:e1:40:99:9f:a4)
        Address: Apple_99:9f:a4 (d0:e1:40:99:9f:a4)
        .... ..0. .... .... .... .... = LG bit: Globally unique address (factory default)
        .... ...0 .... .... .... .... = IG bit: Individual address (unicast)
    Type: IPv6 (0x86dd)
Internet Protocol Version 6, Src: 2603:7000:7e07:fc00:8092:e100:adf7:53e2, Dst: 2607:f8b0:4002:c08::bd
    0110 .... = Version: 6
    .... 0000 0000 .... .... .... .... .... = Traffic Class: 0x00 (DSCP: CS0, ECN: Not-ECT)
        .... 0000 00.. .... .... .... .... .... = Differentiated Services Codepoint: Default (0)
        .... .... ..00 .... .... .... .... .... = Explicit Congestion Notification: Not ECN-Capable Transport (0)
    .... .... .... 0000 0111 1010 0111 0001 = Flow Label: 0x07a71
    Payload Length: 41
    Next Header: UDP (17)
    Hop Limit: 64
    Source Address: 2603:7000:7e07:fc00:8092:e100:adf7:53e2
    Destination Address: 2607:f8b0:4002:c08::bd
User Datagram Protocol, Src Port: 57253, Dst Port: 443
    Source Port: 57253
    Destination Port: 443
    Length: 41
    Checksum: 0x94c1 [unverified]
    [Checksum Status: Unverified]
    [Stream index: 3]
    [Timestamps]
        [Time since first frame: 0.000000000 seconds]
        [Time since previous frame: 0.000000000 seconds]
    UDP payload (33 bytes)
Data (33 bytes)

0000  49 dd bf a1 0e b2 03 21 a2 c9 1b b4 a3 fe 73 82   I......!......s.
0010  2e cf 89 51 ff d7 d7 6d ee 9b 16 6b 9c aa 59 18   ...Q...m...k..Y.
0020  2f                                                /
    Data: 49ddbfa10eb20321a2c91bb4a3fe73822ecf8951ffd7d76dee9b166b9caa59182f
    [Length: 33]

Frame 5: 87 bytes on wire (696 bits), 87 bytes captured (696 bits) on interface en0, id 0
    Interface id: 0 (en0)
        Interface name: en0
        Interface description: Wi-Fi
    Encapsulation type: Ethernet (1)
    Arrival Time: Jul 25, 2021 17:55:02.562842000 EDT
    [Time shift for this packet: 0.000000000 seconds]
    Epoch Time: 1627250102.562842000 seconds
    [Time delta from previous captured frame: 0.066518000 seconds]
    [Time delta from previous displayed frame: 0.066518000 seconds]
    [Time since reference or first frame: 0.155696000 seconds]
    Frame Number: 5
    Frame Length: 87 bytes (696 bits)
    Capture Length: 87 bytes (696 bits)
    [Frame is marked: False]
    [Frame is ignored: False]
    [Protocols in frame: eth:ethertype:ipv6:udp:data]
Ethernet II, Src: ARRISGro_eb:7e:b7 (98:6b:3d:eb:7e:b7), Dst: Apple_99:9f:a4 (d0:e1:40:99:9f:a4)
    Destination: Apple_99:9f:a4 (d0:e1:40:99:9f:a4)
        Address: Apple_99:9f:a4 (d0:e1:40:99:9f:a4)
        .... ..0. .... .... .... .... = LG bit: Globally unique address (factory default)
        .... ...0 .... .... .... .... = IG bit: Individual address (unicast)
    Source: ARRISGro_eb:7e:b7 (98:6b:3d:eb:7e:b7)
        Address: ARRISGro_eb:7e:b7 (98:6b:3d:eb:7e:b7)
        .... ..0. .... .... .... .... = LG bit: Globally unique address (factory default)
        .... ...0 .... .... .... .... = IG bit: Individual address (unicast)
    Type: IPv6 (0x86dd)
Internet Protocol Version 6, Src: 2607:f8b0:4002:c08::bd, Dst: 2603:7000:7e07:fc00:8092:e100:adf7:53e2
    0110 .... = Version: 6
    .... 0000 0000 .... .... .... .... .... = Traffic Class: 0x00 (DSCP: CS0, ECN: Not-ECT)
        .... 0000 00.. .... .... .... .... .... = Differentiated Services Codepoint: Default (0)
        .... .... ..00 .... .... .... .... .... = Explicit Congestion Notification: Not ECN-Capable Transport (0)
    .... .... .... 0000 0000 0000 0000 0000 = Flow Label: 0x00000
    Payload Length: 33
    Next Header: UDP (17)
    Hop Limit: 58
    Source Address: 2607:f8b0:4002:c08::bd
    Destination Address: 2603:7000:7e07:fc00:8092:e100:adf7:53e2
User Datagram Protocol, Src Port: 443, Dst Port: 57253
    Source Port: 443
    Destination Port: 57253
    Length: 33
    Checksum: 0x257c [unverified]
    [Checksum Status: Unverified]
    [Stream index: 3]
    [Timestamps]
        [Time since first frame: 0.066518000 seconds]
        [Time since previous frame: 0.066518000 seconds]
    UDP payload (25 bytes)
Data (25 bytes)

0000  48 15 7d f4 6a d2 75 3e 81 ae f7 56 95 08 95 d0   H.}.j.u>...V....
0010  f0 30 3c ae da 3d 90 c0 38                        .0<..=..8
    Data: 48157df46ad2753e81aef756950895d0f0303caeda3d90c038
    [Length: 25]

Frame 6: 230 bytes on wire (1840 bits), 230 bytes captured (1840 bits) on interface en0, id 0
    Interface id: 0 (en0)
        Interface name: en0
        Interface description: Wi-Fi
    Encapsulation type: Ethernet (1)
    Arrival Time: Jul 25, 2021 17:55:02.694452000 EDT
    [Time shift for this packet: 0.000000000 seconds]
    Epoch Time: 1627250102.694452000 seconds
    [Time delta from previous captured frame: 0.131610000 seconds]
    [Time delta from previous displayed frame: 0.131610000 seconds]
    [Time since reference or first frame: 0.287306000 seconds]
    Frame Number: 6
    Frame Length: 230 bytes (1840 bits)
    Capture Length: 230 bytes (1840 bits)
    [Frame is marked: False]
    [Frame is ignored: False]
    [Protocols in frame: eth:ethertype:ip:udp:data]
Ethernet II, Src: Espressi_8a:24:68 (c4:4f:33:8a:24:68), Dst: Broadcast (ff:ff:ff:ff:ff:ff)
    Destination: Broadcast (ff:ff:ff:ff:ff:ff)
        Address: Broadcast (ff:ff:ff:ff:ff:ff)
        .... ..1. .... .... .... .... = LG bit: Locally administered address (this is NOT the factory default)
        .... ...1 .... .... .... .... = IG bit: Group address (multicast/broadcast)
    Source: Espressi_8a:24:68 (c4:4f:33:8a:24:68)
        Address: Espressi_8a:24:68 (c4:4f:33:8a:24:68)
        .... ..0. .... .... .... .... = LG bit: Globally unique address (factory default)
        .... ...0 .... .... .... .... = IG bit: Individual address (unicast)
    Type: IPv4 (0x0800)
Internet Protocol Version 4, Src: 192.168.0.37, Dst: 255.255.255.255
    0100 .... = Version: 4
    .... 0101 = Header Length: 20 bytes (5)
    Differentiated Services Field: 0x00 (DSCP: CS0, ECN: Not-ECT)
        0000 00.. = Differentiated Services Codepoint: Default (0)
        .... ..00 = Explicit Congestion Notification: Not ECN-Capable Transport (0)
    Total Length: 216
    Identification: 0xf7a1 (63393)
    Flags: 0x00
        0... .... = Reserved bit: Not set
        .0.. .... = Don't fragment: Not set
        ..0. .... = More fragments: Not set
    Fragment Offset: 0
    Time to Live: 255
    Protocol: UDP (17)
    Header Checksum: 0x02a6 [validation disabled]
    [Header checksum status: Unverified]
    Source Address: 192.168.0.37
    Destination Address: 255.255.255.255
User Datagram Protocol, Src Port: 49154, Dst Port: 6667
    Source Port: 49154
    Destination Port: 6667
    Length: 196
    Checksum: 0x685a [unverified]
    [Checksum Status: Unverified]
    [Stream index: 4]
    [Timestamps]
        [Time since first frame: 0.000000000 seconds]
        [Time since previous frame: 0.000000000 seconds]
    UDP payload (188 bytes)
Data (188 bytes)

0000  00 00 55 aa 00 00 00 00 00 00 00 13 00 00 00 ac   ..U.............
0010  00 00 00 00 23 d0 1e 5f ef 56 83 33 14 ce f6 0f   ....#.._.V.3....
0020  b0 86 ed 33 f5 2b 32 60 d1 c1 d5 c2 b9 42 d3 b8   ...3.+2`.....B..
0030  29 48 1a 27 fa e3 61 cb 8f 69 a6 cb 34 8b 7d b9   )H.'..a..i..4.}.
0040  3a 78 9e 7a 9e 0b b0 69 cf 27 b0 0b 3a 22 d8 9a   :x.z...i.'..:"..
0050  f4 aa d2 42 cb 59 24 bb 87 92 fe 5e ae 7c 90 40   ...B.Y$....^.|.@
0060  e5 92 1a 98 01 7f 21 70 86 04 21 e6 fc 66 f0 a1   ......!p..!..f..
0070  ad e1 38 91 5f de 85 0c d1 57 27 0c 5f 3d 1a b5   ..8._....W'._=..
0080  ae 90 b3 00 a3 bb 15 e1 04 de 0c da f5 06 df 1a   ................
0090  0f 55 d6 a9 1c 83 43 bc 25 f3 40 3c 0c 4c 3d b5   .U....C.%.@<.L=.
00a0  93 50 d3 4a e0 bd 1f 2c ba d7 05 88 6d 4e d8 ee   .P.J...,....mN..
00b0  d5 ab 9e b9 3a 0f 7a a0 00 00 aa 55               ....:.z....U
    Data: 000055aa0000000000000013000000ac0000000023d01e5fef56833314cef60fb086ed33…
    [Length: 188]

Frame 7: 230 bytes on wire (1840 bits), 230 bytes captured (1840 bits) on interface en0, id 0
    Interface id: 0 (en0)
        Interface name: en0
        Interface description: Wi-Fi
    Encapsulation type: Ethernet (1)
    Arrival Time: Jul 25, 2021 17:55:02.694886000 EDT
    [Time shift for this packet: 0.000000000 seconds]
    Epoch Time: 1627250102.694886000 seconds
    [Time delta from previous captured frame: 0.000434000 seconds]
    [Time delta from previous displayed frame: 0.000434000 seconds]
    [Time since reference or first frame: 0.287740000 seconds]
    Frame Number: 7
    Frame Length: 230 bytes (1840 bits)
    Capture Length: 230 bytes (1840 bits)
    [Frame is marked: False]
    [Frame is ignored: False]
    [Protocols in frame: eth:ethertype:ip:udp:data]
Ethernet II, Src: Espressi_8b:a7:6f (c4:4f:33:8b:a7:6f), Dst: Broadcast (ff:ff:ff:ff:ff:ff)
    Destination: Broadcast (ff:ff:ff:ff:ff:ff)
        Address: Broadcast (ff:ff:ff:ff:ff:ff)
        .... ..1. .... .... .... .... = LG bit: Locally administered address (this is NOT the factory default)
        .... ...1 .... .... .... .... = IG bit: Group address (multicast/broadcast)
    Source: Espressi_8b:a7:6f (c4:4f:33:8b:a7:6f)
        Address: Espressi_8b:a7:6f (c4:4f:33:8b:a7:6f)
        .... ..0. .... .... .... .... = LG bit: Globally unique address (factory default)
        .... ...0 .... .... .... .... = IG bit: Individual address (unicast)
    Type: IPv4 (0x0800)
Internet Protocol Version 4, Src: 192.168.0.35, Dst: 255.255.255.255
    0100 .... = Version: 4
    .... 0101 = Header Length: 20 bytes (5)
    Differentiated Services Field: 0x00 (DSCP: CS0, ECN: Not-ECT)
        0000 00.. = Differentiated Services Codepoint: Default (0)
        .... ..00 = Explicit Congestion Notification: Not ECN-Capable Transport (0)
    Total Length: 216
    Identification: 0x391f (14623)
    Flags: 0x00
        0... .... = Reserved bit: Not set
        .0.. .... = Don't fragment: Not set
        ..0. .... = More fragments: Not set
    Fragment Offset: 0
    Time to Live: 255
    Protocol: UDP (17)
    Header Checksum: 0xc12a [validation disabled]
    [Header checksum status: Unverified]
    Source Address: 192.168.0.35
    Destination Address: 255.255.255.255
User Datagram Protocol, Src Port: 49154, Dst Port: 6667
    Source Port: 49154
    Destination Port: 6667
    Length: 196
    Checksum: 0xd07e [unverified]
    [Checksum Status: Unverified]
    [Stream index: 5]
    [Timestamps]
        [Time since first frame: 0.000000000 seconds]
        [Time since previous frame: 0.000000000 seconds]
    UDP payload (188 bytes)
Data (188 bytes)

0000  00 00 55 aa 00 00 00 00 00 00 00 13 00 00 00 ac   ..U.............
0010  00 00 00 00 23 d0 1e 5f ef 56 83 33 14 ce f6 0f   ....#.._.V.3....
0020  b0 86 ed 33 eb ff 60 c8 ff 68 6a d8 f1 23 5a 00   ...3..`..hj..#Z.
0030  5d e0 4d c1 45 ba 73 5f f2 37 95 2b 65 8e bf c6   ].M.E.s_.7.+e...
0040  00 2f 84 81 68 46 fd 5c 1c b4 c3 1b c7 07 52 b6   ./..hF.\......R.
0050  45 3e 45 27 cb 59 24 bb 87 92 fe 5e ae 7c 90 40   E>E'.Y$....^.|.@
0060  e5 92 1a 98 01 7f 21 70 86 04 21 e6 fc 66 f0 a1   ......!p..!..f..
0070  ad e1 38 91 5f de 85 0c d1 57 27 0c 5f 3d 1a b5   ..8._....W'._=..
0080  ae 90 b3 00 a3 bb 15 e1 04 de 0c da f5 06 df 1a   ................
0090  0f 55 d6 a9 1c 83 43 bc 25 f3 40 3c 0c 4c 3d b5   .U....C.%.@<.L=.
00a0  93 50 d3 4a e0 bd 1f 2c ba d7 05 88 6d 4e d8 ee   .P.J...,....mN..
00b0  d5 ab 9e b9 8f 3f a0 4f 00 00 aa 55               .....?.O...U
    Data: 000055aa0000000000000013000000ac0000000023d01e5fef56833314cef60fb086ed33…
    [Length: 188]

Frame 8: 275 bytes on wire (2200 bits), 275 bytes captured (2200 bits) on interface en0, id 0
    Interface id: 0 (en0)
        Interface name: en0
        Interface description: Wi-Fi
    Encapsulation type: Ethernet (1)
    Arrival Time: Jul 25, 2021 17:55:02.708682000 EDT
    [Time shift for this packet: 0.000000000 seconds]
    Epoch Time: 1627250102.708682000 seconds
    [Time delta from previous captured frame: 0.013796000 seconds]
    [Time delta from previous displayed frame: 0.013796000 seconds]
    [Time since reference or first frame: 0.301536000 seconds]
    Frame Number: 8
    Frame Length: 275 bytes (2200 bits)
    Capture Length: 275 bytes (2200 bits)
    [Frame is marked: False]
    [Frame is ignored: False]
    [Protocols in frame: eth:ethertype:ipv6:tcp:tls]
Ethernet II, Src: Apple_99:9f:a4 (d0:e1:40:99:9f:a4), Dst: ARRISGro_eb:7e:b7 (98:6b:3d:eb:7e:b7)
    Destination: ARRISGro_eb:7e:b7 (98:6b:3d:eb:7e:b7)
        Address: ARRISGro_eb:7e:b7 (98:6b:3d:eb:7e:b7)
        .... ..0. .... .... .... .... = LG bit: Globally unique address (factory default)
        .... ...0 .... .... .... .... = IG bit: Individual address (unicast)
    Source: Apple_99:9f:a4 (d0:e1:40:99:9f:a4)
        Address: Apple_99:9f:a4 (d0:e1:40:99:9f:a4)
        .... ..0. .... .... .... .... = LG bit: Globally unique address (factory default)
        .... ...0 .... .... .... .... = IG bit: Individual address (unicast)
    Type: IPv6 (0x86dd)
Internet Protocol Version 6, Src: 2603:7000:7e07:fc00:8092:e100:adf7:53e2, Dst: 2600:6c7f:f000:202::7
    0110 .... = Version: 6
    .... 0000 0000 .... .... .... .... .... = Traffic Class: 0x00 (DSCP: CS0, ECN: Not-ECT)
        .... 0000 00.. .... .... .... .... .... = Differentiated Services Codepoint: Default (0)
        .... .... ..00 .... .... .... .... .... = Explicit Congestion Notification: Not ECN-Capable Transport (0)
    .... .... .... 0110 0110 1100 0001 0000 = Flow Label: 0x66c10
    Payload Length: 221
    Next Header: TCP (6)
    Hop Limit: 64
    Source Address: 2603:7000:7e07:fc00:8092:e100:adf7:53e2
    Destination Address: 2600:6c7f:f000:202::7
Transmission Control Protocol, Src Port: 53477, Dst Port: 443, Seq: 1, Ack: 1, Len: 189
    Source Port: 53477
    Destination Port: 443
    [Stream index: 0]
    [TCP Segment Len: 189]
    Sequence Number: 1    (relative sequence number)
    Sequence Number (raw): 3193975189
    [Next Sequence Number: 190    (relative sequence number)]
    Acknowledgment Number: 1    (relative ack number)
    Acknowledgment number (raw): 2251298460
    1000 .... = Header Length: 32 bytes (8)
    Flags: 0x018 (PSH, ACK)
        000. .... .... = Reserved: Not set
        ...0 .... .... = Nonce: Not set
        .... 0... .... = Congestion Window Reduced (CWR): Not set
        .... .0.. .... = ECN-Echo: Not set
        .... ..0. .... = Urgent: Not set
        .... ...1 .... = Acknowledgment: Set
        .... .... 1... = Push: Set
        .... .... .0.. = Reset: Not set
        .... .... ..0. = Syn: Not set
        .... .... ...0 = Fin: Not set
        [TCP Flags: ·······AP···]
    Window: 4096
    [Calculated window size: 4096]
    [Window size scaling factor: -1 (unknown)]
    Checksum: 0x775d [unverified]
    [Checksum Status: Unverified]
    Urgent Pointer: 0
    Options: (12 bytes), No-Operation (NOP), No-Operation (NOP), Timestamps
        TCP Option - No-Operation (NOP)
            Kind: No-Operation (1)
        TCP Option - No-Operation (NOP)
            Kind: No-Operation (1)
        TCP Option - Timestamps: TSval 674616148, TSecr 3752458963
            Kind: Time Stamp Option (8)
            Length: 10
            Timestamp value: 674616148
            Timestamp echo reply: 3752458963
    [SEQ/ACK analysis]
        [Bytes in flight: 189]
        [Bytes sent since last PSH flag: 189]
    [Timestamps]
        [Time since first frame in this TCP stream: 0.000000000 seconds]
        [Time since previous frame in this TCP stream: 0.000000000 seconds]
    TCP payload (189 bytes)
Transport Layer Security
    TLSv1.2 Record Layer: Application Data Protocol: http-over-tls
        Content Type: Application Data (23)
        Version: TLS 1.2 (0x0303)
        Length: 184
        Encrypted Application Data: f134408c5123eb33a040011b53cd69d53e8c2db715c8a227299868d31c7087cd8ca1fd60…
        [Application Data Protocol: http-over-tls]

Frame 9: 275 bytes on wire (2200 bits), 275 bytes captured (2200 bits) on interface en0, id 0
    Interface id: 0 (en0)
        Interface name: en0
        Interface description: Wi-Fi
    Encapsulation type: Ethernet (1)
    Arrival Time: Jul 25, 2021 17:55:02.708745000 EDT
    [Time shift for this packet: 0.000000000 seconds]
    Epoch Time: 1627250102.708745000 seconds
    [Time delta from previous captured frame: 0.000063000 seconds]
    [Time delta from previous displayed frame: 0.000063000 seconds]
    [Time since reference or first frame: 0.301599000 seconds]
    Frame Number: 9
    Frame Length: 275 bytes (2200 bits)
    Capture Length: 275 bytes (2200 bits)
    [Frame is marked: False]
    [Frame is ignored: False]
    [Protocols in frame: eth:ethertype:ipv6:tcp:tls]
Ethernet II, Src: Apple_99:9f:a4 (d0:e1:40:99:9f:a4), Dst: ARRISGro_eb:7e:b7 (98:6b:3d:eb:7e:b7)
    Destination: ARRISGro_eb:7e:b7 (98:6b:3d:eb:7e:b7)
        Address: ARRISGro_eb:7e:b7 (98:6b:3d:eb:7e:b7)
        .... ..0. .... .... .... .... = LG bit: Globally unique address (factory default)
        .... ...0 .... .... .... .... = IG bit: Individual address (unicast)
    Source: Apple_99:9f:a4 (d0:e1:40:99:9f:a4)
        Address: Apple_99:9f:a4 (d0:e1:40:99:9f:a4)
        .... ..0. .... .... .... .... = LG bit: Globally unique address (factory default)
        .... ...0 .... .... .... .... = IG bit: Individual address (unicast)
    Type: IPv6 (0x86dd)
Internet Protocol Version 6, Src: 2603:7000:7e07:fc00:8092:e100:adf7:53e2, Dst: 2600:6c7f:f000:202::7
    0110 .... = Version: 6
    .... 0000 0000 .... .... .... .... .... = Traffic Class: 0x00 (DSCP: CS0, ECN: Not-ECT)
        .... 0000 00.. .... .... .... .... .... = Differentiated Services Codepoint: Default (0)
        .... .... ..00 .... .... .... .... .... = Explicit Congestion Notification: Not ECN-Capable Transport (0)
    .... .... .... 0110 0110 1100 0001 0000 = Flow Label: 0x66c10
    Payload Length: 221
    Next Header: TCP (6)
    Hop Limit: 64
    Source Address: 2603:7000:7e07:fc00:8092:e100:adf7:53e2
    Destination Address: 2600:6c7f:f000:202::7
Transmission Control Protocol, Src Port: 53477, Dst Port: 443, Seq: 190, Ack: 1, Len: 189
    Source Port: 53477
    Destination Port: 443
    [Stream index: 0]
    [TCP Segment Len: 189]
    Sequence Number: 190    (relative sequence number)
    Sequence Number (raw): 3193975378
    [Next Sequence Number: 379    (relative sequence number)]
    Acknowledgment Number: 1    (relative ack number)
    Acknowledgment number (raw): 2251298460
    1000 .... = Header Length: 32 bytes (8)
    Flags: 0x018 (PSH, ACK)
        000. .... .... = Reserved: Not set
        ...0 .... .... = Nonce: Not set
        .... 0... .... = Congestion Window Reduced (CWR): Not set
        .... .0.. .... = ECN-Echo: Not set
        .... ..0. .... = Urgent: Not set
        .... ...1 .... = Acknowledgment: Set
        .... .... 1... = Push: Set
        .... .... .0.. = Reset: Not set
        .... .... ..0. = Syn: Not set
        .... .... ...0 = Fin: Not set
        [TCP Flags: ·······AP···]
    Window: 4096
    [Calculated window size: 4096]
    [Window size scaling factor: -1 (unknown)]
    Checksum: 0xdcca [unverified]
    [Checksum Status: Unverified]
    Urgent Pointer: 0
    Options: (12 bytes), No-Operation (NOP), No-Operation (NOP), Timestamps
        TCP Option - No-Operation (NOP)
            Kind: No-Operation (1)
        TCP Option - No-Operation (NOP)
            Kind: No-Operation (1)
        TCP Option - Timestamps: TSval 674616148, TSecr 3752458963
            Kind: Time Stamp Option (8)
            Length: 10
            Timestamp value: 674616148
            Timestamp echo reply: 3752458963
    [SEQ/ACK analysis]
        [Bytes in flight: 378]
        [Bytes sent since last PSH flag: 189]
    [Timestamps]
        [Time since first frame in this TCP stream: 0.000063000 seconds]
        [Time since previous frame in this TCP stream: 0.000063000 seconds]
    TCP payload (189 bytes)
Transport Layer Security
    TLSv1.2 Record Layer: Application Data Protocol: http-over-tls
        Content Type: Application Data (23)
        Version: TLS 1.2 (0x0303)
        Length: 184
        Encrypted Application Data: a20caa31e2f774769a090d884db3518b811e9bfdf8c1a12c4ca952b769d34add50ee4c47…
        [Application Data Protocol: http-over-tls]

Frame 10: 95 bytes on wire (760 bits), 95 bytes captured (760 bits) on interface en0, id 0
    Interface id: 0 (en0)
        Interface name: en0
        Interface description: Wi-Fi
    Encapsulation type: Ethernet (1)
    Arrival Time: Jul 25, 2021 17:55:02.775789000 EDT
    [Time shift for this packet: 0.000000000 seconds]
    Epoch Time: 1627250102.775789000 seconds
    [Time delta from previous captured frame: 0.067044000 seconds]
    [Time delta from previous displayed frame: 0.067044000 seconds]
    [Time since reference or first frame: 0.368643000 seconds]
    Frame Number: 10
    Frame Length: 95 bytes (760 bits)
    Capture Length: 95 bytes (760 bits)
    [Frame is marked: False]
    [Frame is ignored: False]
    [Protocols in frame: eth:ethertype:ipv6:udp:data]
Ethernet II, Src: Apple_99:9f:a4 (d0:e1:40:99:9f:a4), Dst: ARRISGro_eb:7e:b7 (98:6b:3d:eb:7e:b7)
    Destination: ARRISGro_eb:7e:b7 (98:6b:3d:eb:7e:b7)
        Address: ARRISGro_eb:7e:b7 (98:6b:3d:eb:7e:b7)
        .... ..0. .... .... .... .... = LG bit: Globally unique address (factory default)
        .... ...0 .... .... .... .... = IG bit: Individual address (unicast)
    Source: Apple_99:9f:a4 (d0:e1:40:99:9f:a4)
        Address: Apple_99:9f:a4 (d0:e1:40:99:9f:a4)
        .... ..0. .... .... .... .... = LG bit: Globally unique address (factory default)
        .... ...0 .... .... .... .... = IG bit: Individual address (unicast)
    Type: IPv6 (0x86dd)
Internet Protocol Version 6, Src: 2603:7000:7e07:fc00:8092:e100:adf7:53e2, Dst: 2607:f8b0:4023:c0b::bd
    0110 .... = Version: 6
    .... 0000 0000 .... .... .... .... .... = Traffic Class: 0x00 (DSCP: CS0, ECN: Not-ECT)
        .... 0000 00.. .... .... .... .... .... = Differentiated Services Codepoint: Default (0)
        .... .... ..00 .... .... .... .... .... = Explicit Congestion Notification: Not ECN-Capable Transport (0)
    .... .... .... 1101 0010 1010 0011 1011 = Flow Label: 0xd2a3b
    Payload Length: 41
    Next Header: UDP (17)
    Hop Limit: 64
    Source Address: 2603:7000:7e07:fc00:8092:e100:adf7:53e2
    Destination Address: 2607:f8b0:4023:c0b::bd
User Datagram Protocol, Src Port: 54631, Dst Port: 443
    Source Port: 54631
    Destination Port: 443
    Length: 41
    Checksum: 0xca89 [unverified]
    [Checksum Status: Unverified]
    [Stream index: 6]
    [Timestamps]
        [Time since first frame: 0.000000000 seconds]
        [Time since previous frame: 0.000000000 seconds]
    UDP payload (33 bytes)
Data (33 bytes)

0000  48 d6 8a ad f0 c1 59 19 95 93 63 3f 47 c1 2b 67   H.....Y...c?G.+g
0010  ba c8 c9 f8 7a 50 37 5c b1 15 eb a4 3f 11 c4 3e   ....zP7\....?..>
0020  1f                                                .
    Data: 48d68aadf0c159199593633f47c12b67bac8c9f87a50375cb115eba43f11c43e1f
    [Length: 33]

Frame 11: 86 bytes on wire (688 bits), 86 bytes captured (688 bits) on interface en0, id 0
    Interface id: 0 (en0)
        Interface name: en0
        Interface description: Wi-Fi
    Encapsulation type: Ethernet (1)
    Arrival Time: Jul 25, 2021 17:55:02.787508000 EDT
    [Time shift for this packet: 0.000000000 seconds]
    Epoch Time: 1627250102.787508000 seconds
    [Time delta from previous captured frame: 0.011719000 seconds]
    [Time delta from previous displayed frame: 0.011719000 seconds]
    [Time since reference or first frame: 0.380362000 seconds]
    Frame Number: 11
    Frame Length: 86 bytes (688 bits)
    Capture Length: 86 bytes (688 bits)
    [Frame is marked: False]
    [Frame is ignored: False]
    [Protocols in frame: eth:ethertype:ipv6:tcp]
Ethernet II, Src: ARRISGro_eb:7e:b7 (98:6b:3d:eb:7e:b7), Dst: Apple_99:9f:a4 (d0:e1:40:99:9f:a4)
    Destination: Apple_99:9f:a4 (d0:e1:40:99:9f:a4)
        Address: Apple_99:9f:a4 (d0:e1:40:99:9f:a4)
        .... ..0. .... .... .... .... = LG bit: Globally unique address (factory default)
        .... ...0 .... .... .... .... = IG bit: Individual address (unicast)
    Source: ARRISGro_eb:7e:b7 (98:6b:3d:eb:7e:b7)
        Address: ARRISGro_eb:7e:b7 (98:6b:3d:eb:7e:b7)
        .... ..0. .... .... .... .... = LG bit: Globally unique address (factory default)
        .... ...0 .... .... .... .... = IG bit: Individual address (unicast)
    Type: IPv6 (0x86dd)
Internet Protocol Version 6, Src: 2600:6c7f:f000:202::7, Dst: 2603:7000:7e07:fc00:8092:e100:adf7:53e2
    0110 .... = Version: 6
    .... 0000 0000 .... .... .... .... .... = Traffic Class: 0x00 (DSCP: CS0, ECN: Not-ECT)
        .... 0000 00.. .... .... .... .... .... = Differentiated Services Codepoint: Default (0)
        .... .... ..00 .... .... .... .... .... = Explicit Congestion Notification: Not ECN-Capable Transport (0)
    .... .... .... 0000 0000 0000 0000 0000 = Flow Label: 0x00000
    Payload Length: 32
    Next Header: TCP (6)
    Hop Limit: 52
    Source Address: 2600:6c7f:f000:202::7
    Destination Address: 2603:7000:7e07:fc00:8092:e100:adf7:53e2
Transmission Control Protocol, Src Port: 443, Dst Port: 53477, Seq: 1, Ack: 379, Len: 0
    Source Port: 443
    Destination Port: 53477
    [Stream index: 0]
    [TCP Segment Len: 0]
    Sequence Number: 1    (relative sequence number)
    Sequence Number (raw): 2251298460
    [Next Sequence Number: 1    (relative sequence number)]
    Acknowledgment Number: 379    (relative ack number)
    Acknowledgment number (raw): 3193975567
    1000 .... = Header Length: 32 bytes (8)
    Flags: 0x010 (ACK)
        000. .... .... = Reserved: Not set
        ...0 .... .... = Nonce: Not set
        .... 0... .... = Congestion Window Reduced (CWR): Not set
        .... .0.. .... = ECN-Echo: Not set
        .... ..0. .... = Urgent: Not set
        .... ...1 .... = Acknowledgment: Set
        .... .... 0... = Push: Not set
        .... .... .0.. = Reset: Not set
        .... .... ..0. = Syn: Not set
        .... .... ...0 = Fin: Not set
        [TCP Flags: ·······A····]
    Window: 16326
    [Calculated window size: 16326]
    [Window size scaling factor: -1 (unknown)]
    Checksum: 0xf103 [unverified]
    [Checksum Status: Unverified]
    Urgent Pointer: 0
    Options: (12 bytes), No-Operation (NOP), No-Operation (NOP), Timestamps
        TCP Option - No-Operation (NOP)
            Kind: No-Operation (1)
        TCP Option - No-Operation (NOP)
            Kind: No-Operation (1)
        TCP Option - Timestamps: TSval 3752464863, TSecr 674616148
            Kind: Time Stamp Option (8)
            Length: 10
            Timestamp value: 3752464863
            Timestamp echo reply: 674616148
    [SEQ/ACK analysis]
        [This is an ACK to the segment in frame: 9]
        [The RTT to ACK the segment was: 0.078763000 seconds]
    [Timestamps]
        [Time since first frame in this TCP stream: 0.078826000 seconds]
        [Time since previous frame in this TCP stream: 0.078763000 seconds]

Frame 12: 290 bytes on wire (2320 bits), 290 bytes captured (2320 bits) on interface en0, id 0
    Interface id: 0 (en0)
        Interface name: en0
        Interface description: Wi-Fi
    Encapsulation type: Ethernet (1)
    Arrival Time: Jul 25, 2021 17:55:02.787541000 EDT
    [Time shift for this packet: 0.000000000 seconds]
    Epoch Time: 1627250102.787541000 seconds
    [Time delta from previous captured frame: 0.000033000 seconds]
    [Time delta from previous displayed frame: 0.000033000 seconds]
    [Time since reference or first frame: 0.380395000 seconds]
    Frame Number: 12
    Frame Length: 290 bytes (2320 bits)
    Capture Length: 290 bytes (2320 bits)
    [Frame is marked: False]
    [Frame is ignored: False]
    [Protocols in frame: eth:ethertype:ipv6:tcp:tls]
Ethernet II, Src: ARRISGro_eb:7e:b7 (98:6b:3d:eb:7e:b7), Dst: Apple_99:9f:a4 (d0:e1:40:99:9f:a4)
    Destination: Apple_99:9f:a4 (d0:e1:40:99:9f:a4)
        Address: Apple_99:9f:a4 (d0:e1:40:99:9f:a4)
        .... ..0. .... .... .... .... = LG bit: Globally unique address (factory default)
        .... ...0 .... .... .... .... = IG bit: Individual address (unicast)
    Source: ARRISGro_eb:7e:b7 (98:6b:3d:eb:7e:b7)
        Address: ARRISGro_eb:7e:b7 (98:6b:3d:eb:7e:b7)
        .... ..0. .... .... .... .... = LG bit: Globally unique address (factory default)
        .... ...0 .... .... .... .... = IG bit: Individual address (unicast)
    Type: IPv6 (0x86dd)
Internet Protocol Version 6, Src: 2600:6c7f:f000:202::7, Dst: 2603:7000:7e07:fc00:8092:e100:adf7:53e2
    0110 .... = Version: 6
    .... 0000 0000 .... .... .... .... .... = Traffic Class: 0x00 (DSCP: CS0, ECN: Not-ECT)
        .... 0000 00.. .... .... .... .... .... = Differentiated Services Codepoint: Default (0)
